{"protocol":"grafyn.sync.envelope","schema_version":1,"vault_id":"018f1f09-7b5a-7cc4-98c0-71acb24f24d3","device_id":"018f1f0a-4050-7aca-aebe-16a510f897e8","device_public_key":"oJql9HpnWYAv-VX43C0qFKXJnSO-l_hkEn_5ODRVpPA","operation_id":"d649fc20616de1bbe76245faa67fc7d8828a55c8a5c5a0103176134c8b2320e0","nonce":"MzMzMzMzMzMzMzMzMzMzMzMzMzMzMzMz","ciphertext":"eopNnzV4kPu3vN-DUZTSi4VfpCvSBstX8b8SmKCyxThrTu3qvu6-Z5tqC3k_vyQpw0APK1bPTCDK3B9O0JZjU0hRvtRgMf979jfvjGXi7RSHRIapcYGK9027o0fJN0zXY32zKaTlmBbXNxcr6DvKmwVQ8LIIXNG58tDttq-ZkmhszY90YWzfwQJb1TGmCk-Yi2RwJx5RmKExjbsQJQtjFqJfQl97gZYDU6_v22OkKXoxxlyYdknbdP-u-yX7oaG8SsXou_pDqxfjgxk0wZe3xwjWWNdp-D3nz6N_w9Fua5ZpLKIEJavw3VQaTyMaDqTy_HlNjsFMleRx4BvoEcJSLg_5xYNMK9KKniMciZlv2w-HGcWaHe8cWOSFbr2Fj7T9zOYiy6pGfflK-Gg20TOAqPYc7D5JAHRDm6rTp1HMAJAFKKtuM1Bh9ub8O5O7rHRryI5c81skhZLslRiiJZzL-JG22xU","signature":"nI2mJ78eEzfh6ZuHmxVcGpqMCebpHHPVF3jElvQZMblo6vZgwQ_0aMRjNKVQ_FfOyXrK9WTujEKOFuiD11fvBw"}
